Family,Scientific Name,Common Name,Duration,Habit,Light,Soil Moisture,Height,Color,Bloom Period,Notes
Cupressaceae,Juniperus virginiana,Eastern Red-Cedar,Evergreen,Tree,Sun,Medium,40' - 60',Greenish Brown,March - May,"This species has a wide distribution and is found on many types of soil ranging from acid sands to those derived from limestone. It does best on dry soils in full sunlight, and is winter hardy and tolerant of droughty and salty soils. Like most junipers, it is very slow growing and is moderately long lived."
Asteraceae,Kosteletzkya pentacarpos,Virginia saltmarsh mallow,Perennial,Herb,Sun,Wet,3' - 5',Pink,May - October,"In addition to the long flowering period providing great color, the tolerance of Virginia saltmarsh mallow to a variety of soils, salt spray, salt affected soils, and a wide range of moisture levels make it a valuable and versatile ornamental plant."
Fagaceae,Quercus palustris,Pin Oak,Deciduous,Tree,Sun - Part Shade,Medium - Wet,70' - 90',"Yellow, green, brown",March - May,"Due to this species’ form, adaptability, growth rate, longevity, and fall foliar display, it is popular for ornamental usage. Pin oak is utilized by many game species, especially wood ducks, white-tail deer, and wild turkey. Due to its use by these highly sought after animals, pin oak is commonly planted for food plots."
Poaceae,Leersia oryzoides,Rice Cutgrass,Perennial,Graminoid,Sun - Part Shade,Wet,2-5',Green,June - October,"Rice cutgrass can be found in a variety of wet, sunny, and partially shaded sites. However, it is most common near streams, ponds, or beaver areas, and in ditches, canals, or freshwater marshes. This species thrives best in nutrient rich mud and slow
moving or stagnant water. Rice cutgrass is valuable for wildlife habitat improvement, wetland restoration, and erosion control in ditches and other watercourses. The seeds are an important food source for waterfowl, small mammals, and shorebirds. Ducks pull up and consume underground stems (rhizomes). Dense colonies provide cover and habitat for fish, reptiles, and amphibians."
Asteraceae,Liatris spicata,"Marsh blazing star, Gayfeather",Perennial,Herb,Sun,Medium - Wet,3' - 4',Purple,June - September,"Flowers densely packed on spikes, atracts many pollinators."
Lauraceae,Lindera benzoin,"Spice Bush, Northern Spicebush",Deciduous,Shrub,Sun - Shade,Medium - Wet,6' - 15',Yellow,March - April,"Spicebush plants make nicely shaped shrubs with deep green leaves and, if in at least partial sun, the leaves turn bright yellow in the fall. It is a good choice for plantings in shady locations but can also grow in full sun. Moist soil is best."
Altingiaceae,Liquidambar styraciflua,Sweet Gum,Deciduous,Tree,Sun,Medium - Wet,60' - 100',Green,March - May,"Sweetgum is very intolerant to shade but tolerant to flooding. It also tolerates seaside sites if protected from high winds. In the wild, sweetgum grows in bottomland areas
with rich, moist soil, but can tolerate a variety of soil conditions. The tree does not do well planted in locations where roots are limited in their development."
Magnoliaceae,Liriodendron tulipifera,Tuliptree,Deciduous,Tree,Sun - Part Shade,Medium,80' - 120',Greenish Yellow,April - June,"Tulip poplar makes a desirable street, shade, or ornamental tree but the large size it attains makes it unsuited for many sites. Its good points for aesthetic use are: (1) rapid growth (2) pyramidal form (3) resistance to insect and disease damage (4) unusual leaves and attractive flowers, and (5) yellow autumnal color."
Campanulaceae,Lobelia cardinalis,Cardinalflower,Perennial,Herb,Sun - Shade,Wet,2' - 4',Red,July - October,"A prefered source of food for Hummingbirds, will need some protection from deer browsing."
Campanulaceae,Lobelia siphilitica,Blue Lobelia,Perennial,Herb,Sun - Part Shade,Medium - Wet,2' -3',Blue,July - October,"Great blue lobelia is comparatively easy to grow. The capsules can be collected in autumn, usually October. The seeds will germinate without cold stratification, but they need light, so sow the seeds in a flat with a damp fine grade peat lite mix."
Menyanthaceae,Magnolia virginiana,Sweet Bay Magnolia,Broadleaf Evergreen,Tree,Sun - Part Shade,Medium - Wet,20' - 40',White,May - June,"Sweetbay is valued for its beauty, open form, attractive leaves, and its fragrant flowers. It works well in a shrub border or as a single specimen and can be planted next to buildings or in situations with restricted space due to its horizontal crown. It would be a good choice for rain gardens because it can tolerate saturated soils."
Onocleaceae,Matteuccia struthiopteris,Ostrich Fern,Perennial,Fern,Part Shade - Shade,Wet,3' - 6',NA,NA,"Great shade plant, however requires wet soil and room to spread."
Phyrmaceae,Mimulus ringens,Monkeyflower,Perennial,Herb,Sun - Part Shade,Wet,1' - 3',Purple,July - September,"Great flower for stream banks, or rain gardens."
Lamiaceae/Labiatae,Monarda didyma,"Beebalm, Oswego tea",Perennial,Herb,Sun - Part Shade,Medium - Wet,2' - 5',Red,June - September,"Scarlet beebalm prefers moist but well drained soils. It preforms best in full sunlight but is very adaptable to partial shade conditions. It can often be found along stream banks, thickets, road edges and at the borders to woodland openings."
Lamiaceae/Labiatae,Monarda fistulosa,"Wild bergamot, Horsemint, Beebalm",Perennial,Herb,Sun,Dry - Medium,1' - 4',Violet,June - September,"Wild bergamot is used in flower arrangements. Bees, butterflies and hummingbirds use the plant for nectar. This plant is found in upland woods, thickets, and prairies from Quebec to Manitoba and British Columbia south to Georgia, Louisiana, and Arizona."
Lamiaceae/Labiatae,Monarda punctata,Spotted beebalm,"Annual, Biennial, Perennial",Herb,Sun - Part Shade,Dry,1' - 2',"Pink, White",July - September,Striking flowers that are stacked up the stem. A member of the mint family.
Myricaceae,Morella pensylvanica,Northern bayberry,Perennial,Shrub,Sun - Part Shade,Dry - Medium,5-10’,Yellow,April,"Bayberry can grow in wide range of environments and soils, but it grows most vigorously in sandy or peaty and slightly acidic well drained soils receiving full to partial sun. Bayberry is a highly salt spray tolerant and moderately saline and drought tolerant shrub."
Nymphaeaceae,Nuphar lutea,Yellow pond-lily,Perennial,Herb,Sun - Part Shade,Wet,"6"" - 2'",Yellow,May - October,"Yellow pond-lily flowers and leaves are showy and fragrant. For this reason, it is used as an ornamental planting in water gardens and ponds. Yellow pond-lily provides food and shelter for many fish and underwater insects."
Nymphaeaceae,Nymphaea odorata,American white waterlily,Perennial,Herb,Sun - Shade,Wet,"6"" - 1'",White,May - September,Floating plant with a showy white flower.
Nyssaceae,Nyssa sylvatica,"Tupelo, Black Gum",Deciduous,Tree,Sun - Part Shade,Wet,30-50',"White, green, brown",May - June,"Excellent ornamental plant for its straight bole, shapely crown and attractive autumn foliage."
Onocleaceae,Onoclea sensibilis,Sensitive fern,Perennial,Herb,Part Shade - Shade,Medium - Wet,1' - 4',NA,NA,"This Fern is very senstive to frost. Naturally grows in swampy conditions, but can do well in well watered gardens."
Osmundaceae,Osmunda cinnamomea,Cinnamon Fern,Perennial,Fern,Part Shade - Shade,Medium - Wet,2' - 5',NA,NA,This fern produces a unique cinnamon colored frond that gives it its name.
Osmundaceae,Osmunda regalis,Royal fern,Perennial,Herb,Part Shade - Shade,Wet,2' - 5',NA,NA,Large showy fern.
Poaceae,Panicum amarum,Bitter panicgrass,Perennial,Graminoid,Sun,Dry,7',Green,August - September,"Bitter panicum is adapted to very dry sterile sites. It can withstand periods of extended drought and is somewhat winter hardy. Bitter panicum is consumed by cattle, sheep, and goats."
Fagaceae,Quercus phellos,Willow Oak,Deciduous,Tree,Part Shade,Medium - Wet,72-100',Yellow,March - May,"Willow oak is well adapted to moist, well-drained, acid soils and full sun or light shade, it is widely planted as an ornamental and shade tree."
Poaceae,Panicum virgatum,Switchgrass,Perennial,Graminoid,Full sun - part shade,Medium - Dry,3' - 5',Green,August - September,"Switchgrass is noted for its heavy growth during late spring and early summer. It provides good warm-season pasture and high quality hay for livestock. Switchgrass provides excellent nesting and fall and winter cover for pheasants, quail, and rabbits. It holds up well in heavy snow (particularly ‘Shelter’ and ‘Kanlow’ cultivars) and is useful on shooting preserves. The seeds provide food for pheasants, quail, turkeys, doves, and songbirds."
Vitaceae,Parthenocissus quinquefolia,Virginia Creeper,Perennial,Vine,Sun - Part Shade,Medium - Wet,30' - 50',Green,April - May,"Virginia creeper is found throughout the eastern half of the United States. It prefers moist, well-drained soils but will grow in drier soils and conditions including coastal dune areas. Virginia creeper is fairly shade tolerant, however it is often found along more open clearing borders, fencerows and streambanks. It is also salt tolerant."
Araceae,Peltandra virginica,Green arrow arum,Perennial,Herb,Sun - Part Shade,Wet,"4"" - 2.5'",Green,May - July,"Expansive stands of arrow arum often develop in the marginal waters it inhabits. The foliage and stems in these stands create a wave deflecting or buffering barrier, while the root masses knit together and stabilize the submerged sediments. The roots and shoots translocate methane from the substrate. Arrow arum fruit is a preferred food of wood ducks, and is also eaten by muskrats and rails. The foliage is seldom damaged, providing good cover to waterfowl, wading birds, insects, and aquatic mammals."
Plantaginaceae/Scrophulariaceae,Penstemon hirsutus,Hairy beardtongue,Perennial,Herb,Sun - Shade,Dry - Medium,1' - 3',Purple,May - June,Early blooming flower that can grow well in a vareity of light conditions.
Rosaceae,Physocarpus opulifolius,Common ninebark,Perennial,Shrub,Sun - Shade,Medium - Wet,3' - 10',"White, Pink",May - July,"Common ninebark is cultivated in the US for its foliage, clusters of white flowers in the spring, and red fruits in the autumn. Various cultivars have been selected for compactness of growth, yellow or golden leaf color, and greater size and showiness of flower clusters. Flowers of Common ninebark are an excellent nectar source, and the fruits are eaten by many species of birds."
Pinaceae,Pinus echinata,Shortleaf Pine,Perennial,Tree,Part Shade,Medium - Dry,80' - 100',Yellow,February - March,Suitable for dry sites.
Pinaceae,Pinus rigida,Pitch Pine,Evergreen,Tree,Sun,Medium,40' - 80',Green,March  - May,Fast growing and fire tolerant.
Pinaceae,Pinus virginiana,Virginia Pine,Perennial,Tree,Sun,Medium,20' - 60',NA,April,Medium sized tree that grows in poor soil conditions.
Plantanceae,Platanus occidentalis,American Sycamore,Perennial,Tree,Sun - Shade,Wet,80' - 100',Reddish Brown,March - April,American sycamore is useful in rehabilitation of various sites with saturated soils. It is often a natural early colonizer of disturbed sites.
Pontederiaceae,Pontederia cordata,Pickerelweed,Perennial,Herb,Sun - Part Shade,Wet,1' - 4',Purple,May - October,"Pickerelweed forms large colonies along shallow shorelines. The emergent mass of stems and leaves provide wave-buffering protection. Although slow to spread, the root base of this plant thoroughly covers the sediments with a tough vegetative mat. The seed of pickerelweed is eaten by waterfowl. Geese and muskrats will consume the vegetation, while only fish, and to a lesser extent birds and small mammals, utilize flooded foliage for cover. This species is also used extensively in water gardening, due to its showy violet to blue flowers."
Rosaceae,Prunus maritima,Beach Plum,Deciduous,Shrub,Full sun,Dry,3' - 18’,"White, Pink",April - May,"The beach plum is a staple of the flora that populates the mature dune systems of the Atlantic barrier islands. While beach plum is primarily a coastal species, it can occasionally occur further inland usually nearby tidewater streamsides. Given the dependably profuse bloom of snowy white, conspicuous flowers and the ability to survive in low nutrient, droughty, and salt affected soils, the beach plum has gained value as an ornamental especially for problem sites."
Rosaceae,Prunus serotina,Black Cherry,Deciduous,Tree,Sun - Part Shade,Medium,50-65',White,June,"Black cherry wood is a rich reddish-brown color and is strong, hard, and close-grained – one of the most valued cabinet and furniture woods in North America."
Lamiaceae/Labiatae,Pycnanthemum tenuifolium,Narrowleaf mountainmint,Perennial,Herb,Sun - Part Shade,Dry - Medium,2' - 3',White,July - August,Narrowleaf mountainmint provides a nectar source for pollinators and is well suited for use in pollinator restoration.
Lamiaceae/Labiatae,Pycnanthemum virginianum,Virginia mountainmint,Perennial,Herb,Sun - Part Shade,Medium - Wet,2' - 3',White,June - September,Late summer blooming mint.
Fagaceae,Quercus alba,White Oak,Deciduous,Tree,Sun - Shade,Medium,72' - 100',Red,March - May,"White oak is an excellent ornamental tree because of its broad round crown, dense foliage, and purplish-red to violet-purple fall color."
Fagaceae,Quercus bicolor,Swamp White Oak,Deciduous,Tree,Part Shade,Wet,72-100'',Reddish Green,March - May,"Swamp white oak is planted on highway rights-of-way and is frequently used as a shade tree for large lawns, golf courses, parks, and poorly drained and wet, or even occasionally flooded, and they will tolerate significant soil compaction."
Fagaceae,Quercus coccinea,Scarlet Oak,Deciduous,Tree,Sun,Medium,72' - 100',Yellow,March - May,Brings a great deep red color to the fall landscape.
Fagaceae,Quercus falcata,Southern Red Oak,Deciduous,Tree,Sun - Part Shade,Medium - Dry,60-80',Yellow,March - May,Medium sized shade tree.
Fagaceae,Quercus ilicifolia,Bear oak,Deciduous,Tree,Sun,Dry,12' - 36',Yellow,March - May,"Small tree that does not tolerate shade, often found in the Pine Barrens"
Fagaceae,Quercus marilandica,Blackjack oak,Deciduous,Tree,Sun - Part Shade,Dry,15' - 50',"White, red, green",March - May,Small tree that grows in sandy soil and can be found along the New Jersey coastal plain.
Fagaceae,Quercus montana / prinus,Chestnut Oak,Deciduous,Tree,Part Shade,Medium - Dry,60' - 80',Yellowish Green,March - May,Medium sized tree that grows in dry or rocky soils.
Asteraceae,Solidago nemoralis,Gray goldenrod,Perennial,Herb,Sun,Dry,"6"" - 2.5'",Yellow,September - October,"Grey goldenrod is a beautiful plant in flower and creates an effective groundcover in dry, harsh, sunny conditions. For these reasons it is often used in native landscapes, rock gardens, butterfly gardens and meadow plantings."
Fagaceae,Quercus rubra,Northern Red Oak,Deciduous,Tree,Sun - Part Shade,Medium - Dry,100'+,"Yellow, green, brown",March - May,"Northern red oak is commonly planted as a landscape tree in eastern North America -- used as a shade tree on lawns, parks, campuses, golf courses, etc, where space is sufficient. It is fast growing, easy to transplant, tolerant of urban conditions (including dry and acidic soil and air pollution), the abundant nuts attract wildlife, and the leaves develop a brick-red fall color. It has been used in various rehabilitation projects, including revegetation of coal mine spoils in states of the east central United States (Ohio, Indiana, Illinois, Kentucky, and Pennsylvania)."
Fagaceae,Quercus stellata,Post Oak,Deciduous,Tree,Part Shade,Medium - Dry,30' - 40',"Yellow, brown",March - May,"Draught resistant Oak that grows in dry soils, with distinct cross shaped leaves."
Anadardiaceae,Rhus copallinum,"Shining Sumac, Winged Sumac",Deciduous,Shrub,Sun - Part Shade,Dry,10' - 20',Greenish Yellow,July - September,"Sumac also makes good ornamental plantings and hedges because of the brilliant red fall foliage. While sumacs generally prefer fertile, upland sites they also tolerate a wide variety of conditions. All are tolerant of slightly acid soil conditions and textures ranging from coarse to fine. Typical growing sites include open fields and roadsides, fence rows, railroad rights-of-way, and burned areas. Sumacs are not highly shade tolerate and are considered early successional species."
Anadardiaceae,Rhus glabra,Smooth sumac,Perennial,Tree,Sun - Part Shade,Dry,10' - 15',Greenish Yellow,June - July,"Smooth sumac is widely distributed throughout the United States. It is extremely drought resistant and is commonly found in open fields and roadsides, fence rows, railroad rights-of-way, and burned areas, on sandy or gravelly soil."
Anadardiaceae,Rhus typhina,Staghorn sumac,Perennial,Tree,Sun - shade,Dry - Medium,12' - 36',Greenish Yellow,June - July,"Staghorn sumac is a U.S. native, deciduous, large shrub to small tree that can attain a height of 30-35 feet. It generally prefers fertile, upland sites but tolerates a wide variety of conditions. Sumac is tolerant of slightly acid soil conditions and textures ranging from coarse to fine. Typical growing sites include open fields and roadsides, fence rows, railroad rights-of-way, and burned areas. Sumac is not highly shade tolerate and are considered early successional species."
Rosaceae,Rosa palustris,Swamp rose,Perennial,Subshrub,Part Shade,Wet,1' - 8',Pink,May - June,"Swamp rose is common in marshes and swamps. This species is abundant in swampy habitats and along ditches and streams. It grows best in damp or wet rich loamy soil, in full sunor partial shade."
Rosaceae,Rosa virginiana,Virginia Rose,Deciduous,Shrub,Sun,Medium,4' - 6',Simple rose of pink. Fragrant,May - June,"Virginia rose grows along the edges of salt marshes, roadsides and in pastures. This species succeeds in moist soils, growing well in heavy clayey soils. It prefers a sunny position and does well under winter conditions. This is an outstanding ornamental shrub that is easy to grow."
Salicaceae,Salix discolor,American Pussy Willow,Deciduous,Shrub,Sun,Wet,6' - 20',Catkins,March,"Early blooming shrub that prefers moist soils of stream banks and wetlands, but has some tolerance for less moist inland soils."
Salicaceae,Salix nigra,Black Willow,Deciduous,Tree,Sun - Shade,Medium - Wet,30' -60',Yellow,April - May,Black willow can be planted as an ornamental where a fine-textured shade tree is desired. It will tolerate dry soils with reduced vigor.
Caprifoliaceae,Sambucus nigra subsp. canadensis,American black elderberry,Perennial,Shrub,Sun,Medium - Wet,4' - 12',White,June - August,"It is very decorative when in bloom; elder flowers later than most shrubs. Elderberries are also attractive to makers of pies, jellies and wine."
Lauraceae,Sassafras albidum,Sassafras,Perennial,Tree,Sun - Shade,Medium,30' - 35',Yellowish Green,March - May,later than most shrubs. Elderberries are also
Saururaceae,Saururus cernuus,Lizard's tail,Perennial,Herb,Part Shade - Shade,Wet,1' - 4',White,April - August,"Unique tail like flower that grows in wet soils of pond edges, swamps, and streams."
Poaceae/Gramineae,Schizachyrium scoparium,Little Bluestem,Perennial,Graminoid,Sun,Medium - Dry,2' - 4',"Blue, Red in Fall",August - December,"Little bluestem is becoming more popular for home landscaping because it is a colorful and easy-care addition. New varieties are being developed that don’t lodge (falling over at the base) and are more disease resistant. New growth can be bluish, maturing to a reddish-gold color. The seed develops to a fluffy silver-white. The plumes are showy when seed has matured which adds interest to a cut arrangement. Frost accents the plants and the reddish tint provides color during the winter (Mahr, 2007). This is a prairie grass for the garden that is truly exceptional in mass plantings. Use in full sun."
Cyperaceae,Schoenoplectus pungens,Common threesquare,Perennial,Graminoid,Sun,Wet,1' - 3',Brownish Red,May - July,"Common threesquare occurs in a variety of wetland and riparian plant communities under 2,000 m (6,500) elevation.  It is usually found in standing water about 10 to 15 cm (4 to 6 in) deep, and will tolerate alkaline and saline conditions as well as freshwater.  Common threesquare can survive seasonal drought, when the water table is more than 1 m ( 3 ft) below the surface.  It grows in fine silty clay loam to sandy loam soil."
Cyperaceae,Schoenoplectus tabernaemontani,Softstem bulrush,Perennial,Graminoid,Sun,Wet,6' - 10',Red,April - May,"Soft-stem bulrush occurs in deep or shallow water, or in muddy or marshy ground around lakes, ponds, streams, and wooded wetlands (Guard 1995).  This species usually occurs in poorly drained soil.  It grows better in saline conditions than in fresh water, and it tolerates a wide range of salinity."
Asteraceae,Solidago canadensis,Canada goldenrod,Perennial,Herb,Sun - Part Shade,Medium,1' - 7',Yellow,July - October,"Canada goldenrod is not typically planted in a landscaped setting due to its spreading rhizomatous growth. However, it may be possible to manage plants by planting in a pot submersed in the ground, or by removing new growth each year. Canada goldenrod can be
used for revegetation of disturbed areas, for minespoil reclamation, and soil stabilization. Solidago species provide vital sources of pollen and nectar for bees and other insects in the late summer and fall throughout North America."
Asteraceae,Solidago juncea,Early goldenrod,Perennial,Herb,Sun - Part Shade,Dry,2' - 4',Yellow,July - September,This species is the first of the Goldenrods to bloom.
Poaceae,Sorghastrum nutans,Indiangrass,Perennial,Graminoid,Sun - Part Shade,Medium,3' - 8',Yellow,August - September,"Indiangrass occurs in areas receiving 11 to 45 inches (28 to 114 cm) of annual precipitation (USDA, NRCS 2017).
Indiangrass is best known as part of the tallgrass prairie vegetation in the central United States and grows in association with various grasses including switchgrass (Panicum virgatum), little bluestem (Schizachyrium scoparium), and big bluestem (Andropogon gerardii) (Gould 1975). Indiangrass also occurs in bottomlands, savannahs, and the southern pine region of the southeastern U.S."
Sparganiaceae,Sparganium americanum,American bur-reed,Perennial,Graminoid,Sun - Part Shade,Wet,2',Yellow,May - August,This species grows best on wet ground in rich soil. It prefers full sun but can tolerate some shade. Sparanium species is mostly found in muddy or shallow water of swamps and ponds
Sparganiaceae,Sparganium eurycarpum,Giant bur-reed,Perennial,Herb,Sun - Part Shade,Wet,7',Green,June - August,This species grows best on wet ground in rich soil. It prefers full sun but can tolerate some shade. Sparanium species is mostly found in muddy or shallow water of swamps and ponds.
Sparganiaceae,Spartina alterniflora,Smooth cordgrass,Perennial,Graminoid,Sun,Wet,2' - 6',Yellow,April - May,"Smooth cordgrass is an herbaceous, native, warm season grass that forms dense vegetative colonies along shorelines and intertidal flats in coastal wetlands. Smooth cordgrass is a robust, rapidly spreading plant, tolerant to fluctuating water depths and salinity."
Sparganiaceae,Spartina cynosuroides,Big cordgrass,Perennial,Graminoid,Sun,Wet,3' - 10',NA,August - October,This plant is primarily adapted to mineral soils in salt marshes. It tolerates moderate salinity and water levels that fluctuate from 4 inches below soil surface to 2 inches above. It is closely associated with marsh-hay cordgrass (Spartina patens) and common reed (Phragmites australis).
Sparganiaceae,Spartina patens,Salt marsh cordgrass,Perennial,Graminoid,Sun,Wet,1' - 4',Yellow,June - October,"Saltmeadow cordgrass is used for shoreline protection and tidal marsh restorations, and is often utilized for levee stabilization and dune stabilization plantings near coastal beaches and on barrier islands. It is an important species for dissipating wave energy in low topography relief coastlines (Stallins, 2002). Saltmeadow cordgrass is an effective stabilizer used on interior mud flats, dredge fill sites, and other areas of loose and unconsolidated soils associated with marsh restoration (Burger and Shisler, 1983)."
Sparganiaceae,Spartina pectinata,Prairie cordgrass,Perennial,Graminoid,Sun,Wet - Medium,3' - 8',Yellow,June,"Prairie cordgrass has a broad climatic adaptation. It will grow in seasonally dry sites, tolerates alkaline conditions and high-water tables but is intolerant of prolonged flooding. The rapid seedling development of this species enables it to avoid frost-heaving problems on wetter soils (Bush, 2000)."
Rosaceae,Spiraea alba,White meadowsweet,Perennial,Shrub,Sun - Shade,Wet,4' - 8',White,July - September,Long blooming wetland shrub that feeds many butterflies and beneficial insects.
Rosaceae,Spiraea tomentosa,Steeplebush,Deciduous,Shrub,Sun,Wet,3' - 4',Pink,July - September,Summer blooming shrub that grows in moist to wet soils.
Asteraceae,Symphyotrichum laeve var. laeve,Smooth Blue Aster,Perennial,Herb,Sun - Part Shade,Dry - Medium,1' - 3',Blue,August - October,"The showy flowers of smooth blue aster makes it a popular plant for use in wildflower, native plant, and butterfly gardens."
Asteraceae,Symphyotrichum novae-angliae,New England aster,Perennial,Herb,Sun - Part Shade,Medium - Wet,2' - 6',Purple,August - November,New England aster is known for attracting butterflies and moths to areas where it is found growing. This is a good bee plant providing nectar in the autumn.
Asteraceae,Symphyotrichum novi-belgii,New York Aster,Perennial,Herb,Sun - Part Shade,Medium,1' - 5',Purple,August - October,"New York aster is an excellent upright perennial for a mixed bed or border. This species provides a color accent, bringing autumn color to the garden. New York aster is known for attracting butterflies and moths to areas where it is found growing. This is a good bee plant providing nectar in the autumn."
