Family,Scientific Name,Common Name,Duration,Habit,Light,Soil Moisture,Height,Color,Bloom Period,Notes
Thelypteridaceae,Thelypteris palustris,Eastern marsh fern,Perennial,Herb,Sun,Wet,1' - 2.5',NA,NA,Full sun loving fern that grows in marshes.
Commelinaceae,Tradescantia virginiana,Virginia spiderwort,Perennial,Herb,Sun - Shade,Medium,1' - 2',"White, blue, purple",May - July,"Virginia spiderwort is a vigorous plant that likes moist soils but will adapt to drier, average garden soils. The plants are often seen in old-fashioned gardens and work well as part of a perennial border. They are recommended for bogs and naturally wet sites where the plants can form large clumps when grown in full sun. The plants will flower in both sun and shade. Plants may be propagated from seed but they are more easily started from cuttings or divisions."
Poaceae,Tridens flavus,Purpletop tridens,Perennial,Graminoid,Sun - Part Shade,Medium - Dry,2' - 6',Purple,August - November,"Purpletop tridens is found in a variety of habitats including old fields, prairies, open woods, woodland openings, powerline and railroad rights-of-ways, and roadsides. Purpletop is adapted to sites receiving full sun to partial shade (NC State Extension, 2021). It tolerates dry to moist sandy, sandy loam, loam, clay loam, or clay soils in areas receiving 30 or more inches of rainfall."
Typhaceae,Typha angustifolia,Narrowleaf cattail,Perennial,Herb,Sun,Wet,5' - 10',Yellow (male) green (female) - sausage brown flower spike,April - June,"Cattails are always found in or near water, in marshes, ponds, lakes, and depressional areas. They are obligate wetland indicator plant species. Cattails tolerate perennial flooding, reduced soil conditions, and moderate salinity."
Typhaceae,Typha latifolia,Broadleaf cattail,Perennial,Herb,Sun,Wet,5' - 10',"Yellow, green, brown",April - June,"Cattails are always found in or near water, in marshes, ponds, lakes, and depressional areas. They are obligate wetland indicator plant species. Cattails tolerate perennial flooding, reduced soil conditions, and moderate salinity."
Ericaceae,Vaccinium angustifolium,Lowbush Blueberry,Deciduous,Shrub,Sun - Part Shade,Medium,"2"" - 24""",White,May - June,Low growing Blueberry bush.
Ericaceae,Vaccinium corymbosum,Highbush blueberry,Perennial,Shrub,Sun - Part Shade,Medium - Wet,6' - 12',"White, pink",May,"Sometimes called New Jersey blueberry, highbush blueberry, a native North American shrub cultivated throughout the country, is the major blueberry-producing species in commerce. More than 50 cultivars have been developed, primarily for commercially valuable fruit characteristics and seasonality."
Verbenaceae,Verbena hastata,Swamp verbena,"Biennial, Perennial",Herb,Sun,Medium - Wet,2' - 5',Purple,August - September,"Blue vervain produces very attractive purplish-blue flowers in late summer. It can grow in degraded wetland habitats and is an excellent landscaping substitute for several invasive species, including European wand loosestrife, purple loosestrife, and purple foxglove."
Asteraceae,Verbesina alternifolia,Wingstem,Perennial,Herb,Sun - Part Shade,Medium,4' - 8',Yellow,July - October,Tall flower that blooms late in the summer into the fall.
Asteraceae,Vernonia noveboracensis,New York ironweed,Perennial,Herb,Sun - Part Shade,Medium - Wet,5' - 8',Magenta,August - September,Tall perennial with clusters of purple flowers.
Plantaginaceae,Veronicastrum virginicum,Culver's root,Perennial,Herb,Sun,Medium - Wet,3' - 6',White,July - September,"Culver’s root is a tall, durable, adaptable and easily grown. It’s beautiful (usually white, purple to pink) flowers occur at a time of year (July - September) when most other plants are not flowering. It sometimes needs staking and is a good wildflower for meadows, borders, wetlands and rain gardens. It makes a nice cut flower lasting as much as a week in fresh arrangements."
Adoxaceae,Viburnum dentatum,Southern arrowwood,Deciduous,Shrub,Sun - Part Shade,Medium,3' - 9',White,May - June,"Southern Arrowwood is an adaptable native, multi-stemmed shrub. Creamy white flowers, dark blue berries and colorful fall foliage make southern arrowwood an attractive landscape plant. It suckers freely from the base. It can be used for borders or screens or as mass plantings and groupings to attract birds, which eat the fruit."
Adoxaceae,Viburnum lentago,Nannyberry,Deciduous,Shrub,Sun - Shade,Medium - Wet,15' - 36',White,May - June,"Nannyberry is a shade-tolerant, understory species useful in landscape plantings as shrub borders, taller barriers, hedges, and windbreaks. It produces good seasonal displays of flowers, fruits, and fall leaf color. The fruits are sweet and edible and are eaten by many species of birds and wildlife"
Adoxaceae,Viburnum nudum,Possumhaw,Perennial,Shrub,Sun - Part Shade,Medium - Wet,5' - 12’,White,May - June,Shrub with white flowers in late spring early summer.
Adoxaceae,Viburnum prunifolium,Blackhaw viburnum,Deciduous,Shrub,Sun - Part Shade,Medium,10' - 20',White,April - June,"Large shrub with clisters of white flowers, can tolerate a range of soil and light conditions."
Apiaceae/Umbelliferae,Zizia aurea,Golden Alexanders,Perennial,Herb,Sun,Wet,1' - 2',Yellow,May - June,"Golden Alexanders has its greatest potential as a component of conservation mixes and wildflower gardens. In wet, sunny meadows and open woodlands it will naturalize. The flowers are attractive to many kinds of butterflies and many other insects. It is an excellent source of accessible pollen and nectar to many beneficial insects with short mouthparts."
Cupressaceae,Chamaecyparis thyoides,Atlantic White Cedar,Evergreen,Tree,Sun - Part Shade,Wet,40' - 60',Green,March - May,"Atlantic white cedar is an evergreen with scaly leaves that occur in a flat fern-like appearance. This species usually grows in very dense, solid stands, and has small rounded cones."
Fabaceae,Cercis canadensis,Eastern Red Bud,Deciduous,Tree,Part Shade - Shade,Medium,15' - 30',Pink,March - May,"Eastern redbud is usually one of the first trees to bloom in spring. Pink to reddish purple flowers are grown on old twigs, branches, and trunks. Flowering occurs in March to May before leaf growth."
Caprifoliaceae,Lonicera sempervirens,Trumpet Honeysuckle,Perennial,Vine,Sun - Part Shade,Medium,4' - 20',Red Orange,May - June,"The prefered source of nectar for hummingbirds, can grow in a wide range of conditions. Can be evergreen in Southern states with warmer winters"
